{
  "version": 1,
  "checkedAt": "2026-10-14",
  "contrast": { "target": 4.6, "border": 3.1, "standard": 4.5, "nonText": 3 },
  "fixed": {
    "error": { "light": "#C42B36", "dark": "#FF8E8E" },
    "success": { "light": "#1B7A4A", "dark": "#6FD69C" },
    "onLight": ["#FFFFFF", "#111111"],
    "onDark": "#0B1220"
  },
  "moods": [
    {
      "id": "clean",
      "label": "깔끔하게",
      "keywordsKo": ["깔끔한", "여백이 넉넉한", "정돈된"],
      "keywordsEn": ["clean", "airy", "orderly"],
      "neutral": "cool",
      "accent": "blue",
      "font": "basic",
      "radius": "slight",
      "depth": "line",
      "icons": "lucide",
      "motion": "subtle",
      "mapPalette": "clean"
    },
    {
      "id": "cute",
      "label": "귀엽게",
      "keywordsKo": ["말랑한", "밝은", "둥근"],
      "keywordsEn": ["playful", "soft", "rounded"],
      "neutral": "pink",
      "accent": "pink",
      "font": "round",
      "radius": "pill",
      "depth": "soft",
      "icons": "phosphor",
      "motion": "lively",
      "mapPalette": "cute"
    },
    {
      "id": "serious",
      "label": "차분하고 믿음직하게",
      "keywordsKo": ["단정한", "믿음직한", "또렷한"],
      "keywordsEn": ["calm", "trustworthy", "structured"],
      "neutral": "cool",
      "accent": "navy",
      "font": "basic",
      "radius": "square",
      "radiusValues": [4, 4, 6],
      "depth": "flat",
      "icons": "lucide",
      "motion": "none",
      "tabularNums": true,
      "mapPalette": "calm"
    },
    {
      "id": "bold",
      "label": "강렬하게",
      "keywordsKo": ["굵은", "또렷한", "포스터 같은"],
      "keywordsEn": ["bold", "high-contrast", "poster-like"],
      "neutral": "ink",
      "accent": "red",
      "font": "heavy",
      "radius": "square",
      "radiusValues": [0, 2, 4],
      "depth": "ink",
      "icons": "tabler",
      "motion": "subtle",
      "motionStyle": "short",
      "mapPalette": "bold"
    },
    {
      "id": "warm",
      "label": "포근하게",
      "keywordsKo": ["포근한", "손편지 같은", "느긋한"],
      "keywordsEn": ["warm", "gentle", "cozy"],
      "neutral": "warm",
      "accent": "green",
      "font": "soft",
      "radius": "round",
      "depth": "faint",
      "icons": "phosphor",
      "motion": "subtle",
      "mapPalette": "cute"
    },
    {
      "id": "retro",
      "label": "오락실처럼",
      "keywordsKo": ["도트", "오락실", "딱딱 끊기는"],
      "keywordsEn": ["retro", "pixel", "arcade"],
      "neutral": "cool",
      "accent": "purple",
      "font": "pixel",
      "radius": "square",
      "radiusValues": [0, 0, 0],
      "depth": "offset",
      "icons": "tabler",
      "motion": "subtle",
      "motionStyle": "steps",
      "mapPalette": "bold"
    }
  ],
  "neutrals": [
    {
      "id": "cool",
      "label": "차가운 회색",
      "light": { "bg": "#FFFFFF", "surface": "#F5F7FA", "text": "#18202B", "muted": "#586272", "border": "#7B8494", "line": "#E1E5EA" },
      "dark": { "bg": "#111418", "surface": "#1A1E24", "text": "#ECEEF1", "muted": "#A9B0BA", "border": "#737C88", "line": "#2A3038" }
    },
    {
      "id": "pink",
      "label": "분홍 기운",
      "light": { "bg": "#FFFFFF", "surface": "#FFF1F6", "text": "#2B2130", "muted": "#6B5A68", "border": "#8E7C8B", "line": "#F2DCE5" },
      "dark": { "bg": "#161216", "surface": "#211A20", "text": "#F5ECF1", "muted": "#BCA9B5", "border": "#86727F", "line": "#33282F" }
    },
    {
      "id": "ink",
      "label": "먹",
      "light": { "bg": "#FFFFFF", "surface": "#F1F1F1", "text": "#0A0A0A", "muted": "#4A4A4A", "border": "#0A0A0A", "line": "#D4D4D4" },
      "dark": { "bg": "#0D0D0D", "surface": "#1A1A1A", "text": "#F5F5F5", "muted": "#B5B5B5", "border": "#F5F5F5", "line": "#333333" }
    },
    {
      "id": "warm",
      "label": "따뜻한 회색",
      "light": { "bg": "#FFFFFF", "surface": "#F7F4F0", "text": "#2A2420", "muted": "#6A5F57", "border": "#8C8178", "line": "#E8E1DA" },
      "dark": { "bg": "#15120F", "surface": "#1F1B17", "text": "#F1ECE6", "muted": "#B3A99F", "border": "#857A70", "line": "#312B25" }
    }
  ],
  "accents": [
    { "id": "blue", "label": "파랑", "light": "#1D63D6", "dark": "#7AB0FF", "soft": "#EAF2FF" },
    { "id": "navy", "label": "남색", "light": "#2A3B8F", "dark": "#A3B3FF", "soft": "#ECEFFC" },
    { "id": "teal", "label": "청록", "light": "#02777D", "dark": "#5FD3D6", "soft": "#E3F6F6" },
    { "id": "green", "label": "초록", "light": "#1B7A4A", "dark": "#6FD69C", "soft": "#E6F5EC" },
    { "id": "orange", "label": "주황", "light": "#B9470B", "dark": "#FFA066", "soft": "#FDEEE4" },
    { "id": "red", "label": "빨강", "light": "#C42B36", "dark": "#FF8E8E", "soft": "#FDECEC" },
    { "id": "pink", "label": "분홍", "light": "#B8236F", "dark": "#FF8CC8", "soft": "#FCEAF3" },
    { "id": "purple", "label": "보라", "light": "#6A45D1", "dark": "#B9A6FF", "soft": "#F0ECFC" },
    { "id": "brown", "label": "갈색", "light": "#8A5634", "dark": "#E0B48F", "soft": "#F5EDE6" },
    { "id": "ink", "label": "먹색", "light": "#1F2937", "dark": "#E5E7EB", "soft": "#ECEEF1" }
  ],
  "themes": [
    { "id": "light", "label": "밝게만" },
    { "id": "dark", "label": "어둡게만" },
    { "id": "both", "label": "둘 다(기기 설정 따라)" }
  ],
  "families": [
    {
      "id": "pretendard",
      "name": "Pretendard",
      "css": "\"Pretendard Variable\", Pretendard",
      "fallback": "-apple-system, BlinkMacSystemFont, \"Apple SD Gothic Neo\", \"Noto Sans KR\", \"Malgun Gothic\", sans-serif",
      "license": "OFL-1.1",
      "package": "pretendard",
      "version": "1.3.9",
      "html": "<link rel=\"stylesheet\" as=\"style\" crossorigin href=\"https://cdn.jsdelivr.net/gh/orioncactus/pretendard@v1.3.9/dist/web/variable/pretendardvariable-dynamic-subset.min.css\" />",
      "npm": { "install": "npm install pretendard", "import": "import 'pretendard/dist/web/variable/pretendardvariable-dynamic-subset.css';" },
      "home": "https://github.com/orioncactus/pretendard",
      "checkedAt": "2026-10-14",
      "needsReview": false,
      "sources": ["https://www.npmjs.com/package/pretendard", "https://github.com/orioncactus/pretendard"]
    },
    {
      "id": "suit",
      "name": "SUIT",
      "css": "SUIT",
      "fallback": "-apple-system, BlinkMacSystemFont, \"Apple SD Gothic Neo\", \"Noto Sans KR\", \"Malgun Gothic\", sans-serif",
      "license": "OFL-1.1",
      "package": "@sun-typeface/suit",
      "version": "2.0.5",
      "npm": { "install": "npm install @sun-typeface/suit", "import": "import '@sun-typeface/suit/fonts/static/woff2/SUIT.css';" },
      "home": "https://sun.fo/suit/",
      "checkedAt": "2026-10-14",
      "needsReview": false,
      "sources": ["https://www.npmjs.com/package/@sun-typeface/suit", "https://github.com/sun-typeface/SUIT"]
    },
    {
      "id": "gowun-dodum",
      "name": "고운돋움 (Gowun Dodum)",
      "css": "\"Gowun Dodum\"",
      "fallback": "\"Pretendard Variable\", Pretendard, sans-serif",
      "license": "OFL-1.1",
      "package": "@fontsource/gowun-dodum",
      "version": "5.3.0",
      "html": "<link rel=\"stylesheet\" href=\"https://fonts.googleapis.com/css2?family=Gowun+Dodum&display=swap\" />",
      "npm": { "install": "npm install @fontsource/gowun-dodum", "import": "import '@fontsource/gowun-dodum';" },
      "home": "https://fontsource.org/fonts/gowun-dodum",
      "checkedAt": "2026-10-14",
      "needsReview": false,
      "sources": ["https://www.npmjs.com/package/@fontsource/gowun-dodum", "https://fonts.googleapis.com/css2?family=Gowun+Dodum&display=swap"]
    },
    {
      "id": "gowun-batang",
      "name": "고운바탕 (Gowun Batang)",
      "css": "\"Gowun Batang\"",
      "fallback": "serif",
      "license": "OFL-1.1",
      "package": "@fontsource/gowun-batang",
      "version": "5.3.0",
      "html": "<link rel=\"stylesheet\" href=\"https://fonts.googleapis.com/css2?family=Gowun+Batang:wght@700&display=swap\" />",
      "npm": { "install": "npm install @fontsource/gowun-batang", "import": "import '@fontsource/gowun-batang/700.css';" },
      "home": "https://fontsource.org/fonts/gowun-batang",
      "checkedAt": "2026-10-14",
      "needsReview": false,
      "sources": ["https://www.npmjs.com/package/@fontsource/gowun-batang", "https://fonts.googleapis.com/css2?family=Gowun+Batang:wght@700&display=swap"]
    },
    {
      "id": "jua",
      "name": "주아 (Jua)",
      "css": "Jua",
      "fallback": "\"Pretendard Variable\", Pretendard, sans-serif",
      "license": "OFL-1.1",
      "package": "@fontsource/jua",
      "version": "5.3.0",
      "html": "<link rel=\"stylesheet\" href=\"https://fonts.googleapis.com/css2?family=Jua&display=swap\" />",
      "npm": { "install": "npm install @fontsource/jua", "import": "import '@fontsource/jua';" },
      "home": "https://fontsource.org/fonts/jua",
      "checkedAt": "2026-10-14",
      "needsReview": false,
      "sources": ["https://www.npmjs.com/package/@fontsource/jua", "https://fonts.googleapis.com/css2?family=Jua&display=swap"]
    },
    {
      "id": "black-han-sans",
      "name": "검은고딕 (Black Han Sans)",
      "css": "\"Black Han Sans\"",
      "fallback": "\"Pretendard Variable\", Pretendard, sans-serif",
      "license": "OFL-1.1",
      "package": "@fontsource/black-han-sans",
      "version": "5.3.0",
      "html": "<link rel=\"stylesheet\" href=\"https://fonts.googleapis.com/css2?family=Black+Han+Sans&display=swap\" />",
      "npm": { "install": "npm install @fontsource/black-han-sans", "import": "import '@fontsource/black-han-sans';" },
      "home": "https://fontsource.org/fonts/black-han-sans",
      "checkedAt": "2026-10-14",
      "needsReview": false,
      "sources": ["https://www.npmjs.com/package/@fontsource/black-han-sans", "https://fonts.googleapis.com/css2?family=Black+Han+Sans&display=swap"]
    },
    {
      "id": "gaegu",
      "name": "개구 (Gaegu)",
      "css": "Gaegu",
      "fallback": "\"Pretendard Variable\", Pretendard, sans-serif",
      "license": "OFL-1.1",
      "package": "@fontsource/gaegu",
      "version": "5.3.0",